{
 "$schema": "schema/ordlistor.schema.json",
 "format": 1,
 "meta": {
  "version": "0.4",
  "datum": "2026-10-25",
  "agare": "Innehåll",
  "textform": "Orden lagras med små bokstäver, formler i versaler. Böjda former (skogen, bron) står med när de används som alternativ.",
  "beskrivning": "Ordlistor 1-6 for ORDSTAVEN. Bilderna ar platshallare (emoji) for grabox. Ett ord ligger i den hogsta lista som nagot av dess drag kraver.",
  "bilder": "Emoji är platshållare. Där emojin är missvisande står ett bild-id i stället (filt)."
 },
 "listor": {
  "1": "Korta ljudenliga ord, 2-3 bokstaver, ingen konsonantgrupp, ingen dubbelteckning",
  "2": "Langre ljudenliga ord (4-6 bokstaver) eller konsonantgrupp i slutet",
  "3": "Konsonantgrupp i borjan",
  "4": "Kort vokal med dubbelteckning (aven CK)",
  "5": "Svara ljud (LJ, sj, tj, NG, mjukt G/K). Sparrade i lastext utom formler med forebild",
  "6": "Smaord som ordbilder"
 },
 "flaggor": {
  "aao": "Innehaller A-ring, A-prickar eller O-prickar. Se regler for distraktorer",
  "helord": "Lases upp som helt ord, aldrig ljudat bokstav for bokstav",
  "sparrad": "Far inte forekomma i text spelaren laser sjalv annu",
  "berattelseord": "Far forekomma tidigt som ordbild trots listan",
  "formel": "Trollformel, lars med forebild (S1)",
  "ordbild": "Smaord som lars som helhet"
 },
 "forbjudna_par": [
  [
   "lås",
   "läs"
  ],
  [
   "hår",
   "här"
  ],
  [
   "bår",
   "bär"
  ]
 ],
 "regler": [
  "L1-L3: ratt svar och distraktor far aldrig skilja sig bara pa å/ä",
  "Har ratt svar å, ä eller ö valjs distraktorer i L1-L2 helst utan dessa bokstaver",
  "å för ä (och tvartom) i skrivuppgifter raknas som nara stavning, inte fel",
  "Ord med flaggan sparrad far bara forekomma i uppläst text"
 ],
 "ord": [
  {
   "ord": "apa",
   "lista": 1,
   "bild": "🐒",
   "tema": "djur",
   "flaggor": []
  },
  {
   "ord": "bad",
   "lista": 1,
   "bild": "🛁",
   "tema": "hemma",
   "flaggor": []
  },
  {
   "ord": "ben",
   "lista": 1,
   "bild": "🦴",
   "tema": "dino",
   "flaggor": []
  },
  {
   "ord": "bil",
   "lista": 1,
   "bild": "🚗",
   "tema": "bilar",
   "flaggor": []
  },
  {
   "ord": "byn",
   "lista": 1,
   "bild": "🏘️",
   "tema": "natur",
   "flaggor": []
  },
  {
   "ord": "bär",
   "lista": 1,
   "bild": "🫐",
   "tema": "mat",
   "flaggor": [
    "aao"
   ]
  },
  {
   "ord": "båt",
   "lista": 1,
   "bild": "⛵",
   "tema": "fordon",
   "flaggor": [
    "aao"
   ]
  },
  {
   "ord": "dal",
   "lista": 1,
   "bild": "🏞️",
   "tema": "natur",
   "flaggor": []
  },
  {
   "ord": "fot",
   "lista": 1,
   "bild": "🦶",
   "tema": "dino",
   "flaggor": []
  },
  {
   "ord": "gul",
   "lista": 1,
   "bild": "🟨",
   "tema": "färg",
   "flaggor": []
  },
  {
   "ord": "hus",
   "lista": 1,
   "bild": "🏠",
   "tema": "hemma",
   "flaggor": []
  },
  {
   "ord": "hög",
   "lista": 1,
   "bild": "⬆️",
   "tema": "egenskap",
   "flaggor": [
    "aao"
   ]
  },
  {
   "ord": "is",
   "lista": 1,
   "bild": "🧊",
   "tema": "natur",
   "flaggor": []
  },
  {
   "ord": "ko",
   "lista": 1,
   "bild": "🐄",
   "tema": "djur",
   "flaggor": []
  },
  {
   "ord": "lås",
   "lista": 1,
   "bild": "🔒",
   "tema": "skatt",
   "flaggor": [
    "aao"
   ]
  },
  {
   "ord": "lök",
   "lista": 1,
   "bild": "🧅",
   "tema": "mat",
   "flaggor": [
    "aao"
   ]
  },
  {
   "ord": "löv",
   "lista": 1,
   "bild": "🍂",
   "tema": "natur",
   "flaggor": [
    "aao"
   ]
  },
  {
   "ord": "mat",
   "lista": 1,
   "bild": "🍽️",
   "tema": "mat",
   "flaggor": []
  },
  {
   "ord": "mus",
   "lista": 1,
   "bild": "🐭",
   "tema": "djur",
   "flaggor": []
  },
  {
   "ord": "mål",
   "lista": 1,
   "bild": "🏁",
   "tema": "bilar",
   "flaggor": [
    "aao"
   ]
  },
  {
   "ord": "nos",
   "lista": 1,
   "bild": "👃",
   "tema": "dino",
   "flaggor": []
  },
  {
   "ord": "rep",
   "lista": 1,
   "bild": "🪢",
   "tema": "verktyg",
   "flaggor": []
  },
  {
   "ord": "röd",
   "lista": 1,
   "bild": "🟥",
   "tema": "färg",
   "flaggor": [
    "aao"
   ]
  },
  {
   "ord": "sol",
   "lista": 1,
   "bild": "☀️",
   "tema": "natur",
   "flaggor": []
  },
  {
   "ord": "sov",
   "lista": 1,
   "bild": "🛏️",
   "tema": "hemma",
   "flaggor": []
  },
  {
   "ord": "sur",
   "lista": 1,
   "bild": "😖",
   "tema": "känsla",
   "flaggor": []
  },
  {
   "ord": "säl",
   "lista": 1,
   "bild": "🦭",
   "tema": "djur",
   "flaggor": [
    "aao"
   ]
  },
  {
   "ord": "tak",
   "lista": 1,
   "bild": "🏠",
   "tema": "hemma",
   "flaggor": []
  },
  {
   "ord": "toa",
   "lista": 1,
   "bild": "🚽",
   "tema": "hemma",
   "flaggor": []
  },
  {
   "ord": "tåg",
   "lista": 1,
   "bild": "🚂",
   "tema": "fordon",
   "flaggor": [
    "aao"
   ]
  },
  {
   "ord": "vit",
   "lista": 1,
   "bild": "⬜",
   "tema": "färg",
   "flaggor": []
  },
  {
   "ord": "banan",
   "lista": 2,
   "bild": "🍌",
   "tema": "mat",
   "flaggor": []
  },
  {
   "ord": "dino",
   "lista": 2,
   "bild": "🦕",
   "tema": "dino",
   "flaggor": []
  },
  {
   "ord": "dinomat",
   "lista": 2,
   "bild": "🦕",
   "tema": "dino",
   "flaggor": []
  },
  {
   "ord": "eld",
   "lista": 2,
   "bild": "🔥",
   "tema": "natur",
   "flaggor": []
  },
  {
   "ord": "filt",
   "lista": 2,
   "bild": "filt",
   "tema": "hemma",
   "flaggor": []
  },
  {
   "ord": "fisk",
   "lista": 2,
   "bild": "🐟",
   "tema": "djur",
   "flaggor": []
  },
  {
   "ord": "godis",
   "lista": 2,
   "bild": "🍬",
   "tema": "mat",
   "flaggor": []
  },
  {
   "ord": "hund",
   "lista": 2,
   "bild": "🐶",
   "tema": "djur",
   "flaggor": []
  },
  {
   "ord": "häst",
   "lista": 2,
   "bild": "🐴",
   "tema": "djur",
   "flaggor": [
    "aao"
   ]
  },
  {
   "ord": "karta",
   "lista": 2,
   "bild": "🗺️",
   "tema": "skatt",
   "flaggor": []
  },
  {
   "ord": "korv",
   "lista": 2,
   "bild": "🌭",
   "tema": "mat",
   "flaggor": []
  },
  {
   "ord": "kula",
   "lista": 2,
   "bild": "🔮",
   "tema": "magi",
   "flaggor": []
  },
  {
   "ord": "lampa",
   "lista": 2,
   "bild": "💡",
   "tema": "hemma",
   "flaggor": []
  },
  {
   "ord": "lejon",
   "lista": 2,
   "bild": "🦁",
   "tema": "djur",
   "flaggor": []
  },
  {
   "ord": "liten",
   "lista": 2,
   "bild": "🤏",
   "tema": "egenskap",
   "flaggor": []
  },
  {
   "ord": "lysa",
   "lista": 2,
   "bild": "✨",
   "tema": "magi",
   "flaggor": []
  },
  {
   "ord": "låda",
   "lista": 2,
   "bild": "📦",
   "tema": "hemma",
   "flaggor": [
    "aao"
   ]
  },
  {
   "ord": "moln",
   "lista": 2,
   "bild": "☁️",
   "tema": "natur",
   "flaggor": []
  },
  {
   "ord": "mynt",
   "lista": 2,
   "bild": "🪙",
   "tema": "skatt",
   "flaggor": []
  },
  {
   "ord": "måne",
   "lista": 2,
   "bild": "🌙",
   "tema": "natur",
   "flaggor": [
    "aao"
   ]
  },
  {
   "ord": "orm",
   "lista": 2,
   "bild": "🐍",
   "tema": "djur",
   "flaggor": []
  },
  {
   "ord": "ost",
   "lista": 2,
   "bild": "🧀",
   "tema": "mat",
   "flaggor": []
  },
  {
   "ord": "pirat",
   "lista": 2,
   "bild": "🏴‍☠️",
   "tema": "skatt",
   "flaggor": []
  },
  {
   "ord": "radio",
   "lista": 2,
   "bild": "📻",
   "tema": "hemma",
   "flaggor": []
  },
  {
   "ord": "raket",
   "lista": 2,
   "bild": "🚀",
   "tema": "fordon",
   "flaggor": []
  },
  {
   "ord": "röda",
   "lista": 2,
   "bild": "🟥",
   "tema": "färg",
   "flaggor": [
    "aao"
   ]
  },
  {
   "ord": "salt",
   "lista": 2,
   "bild": "🧂",
   "tema": "mat",
   "flaggor": []
  },
  {
   "ord": "tomat",
   "lista": 2,
   "bild": "🍅",
   "tema": "mat",
   "flaggor": []
  },
  {
   "ord": "örn",
   "lista": 2,
   "bild": "🦅",
   "tema": "djur",
   "flaggor": [
    "aao"
   ]
  },
  {
   "ord": "blad",
   "lista": 3,
   "bild": "🍃",
   "tema": "natur",
   "flaggor": []
  },
  {
   "ord": "blå",
   "lista": 3,
   "bild": "🟦",
   "tema": "färg",
   "flaggor": [
    "aao"
   ]
  },
  {
   "ord": "brev",
   "lista": 3,
   "bild": "✉️",
   "tema": "skatt",
   "flaggor": []
  },
  {
   "ord": "bro",
   "lista": 3,
   "bild": "🌉",
   "tema": "verktyg",
   "flaggor": []
  },
  {
   "ord": "bron",
   "lista": 3,
   "bild": "🌉",
   "tema": "natur",
   "flaggor": []
  },
  {
   "ord": "flod",
   "lista": 3,
   "bild": "🏞️",
   "tema": "natur",
   "flaggor": []
  },
  {
   "ord": "FLYG",
   "lista": 3,
   "bild": "🪶",
   "tema": "formel",
   "flaggor": [
    "formel"
   ]
  },
  {
   "ord": "glas",
   "lista": 3,
   "bild": "🥛",
   "tema": "hemma",
   "flaggor": []
  },
  {
   "ord": "gris",
   "lista": 3,
   "bild": "🐷",
   "tema": "djur",
   "flaggor": []
  },
  {
   "ord": "grön",
   "lista": 3,
   "bild": "🟩",
   "tema": "färg",
   "flaggor": [
    "aao"
   ]
  },
  {
   "ord": "klo",
   "lista": 3,
   "bild": "🦖",
   "tema": "dino",
   "flaggor": []
  },
  {
   "ord": "kran",
   "lista": 3,
   "bild": "🏗️",
   "tema": "fordon",
   "flaggor": []
  },
  {
   "ord": "kruka",
   "lista": 3,
   "bild": "🏺",
   "tema": "hemma",
   "flaggor": []
  },
  {
   "ord": "skal",
   "lista": 3,
   "bild": "🥚",
   "tema": "dino",
   "flaggor": []
  },
  {
   "ord": "sko",
   "lista": 3,
   "bild": "👟",
   "tema": "hemma",
   "flaggor": []
  },
  {
   "ord": "skog",
   "lista": 3,
   "bild": "🌲",
   "tema": "natur",
   "flaggor": []
  },
  {
   "ord": "skogen",
   "lista": 3,
   "bild": "🌲",
   "tema": "natur",
   "flaggor": []
  },
  {
   "ord": "skola",
   "lista": 3,
   "bild": "🏫",
   "tema": "hemma",
   "flaggor": []
  },
  {
   "ord": "snigel",
   "lista": 3,
   "bild": "🐌",
   "tema": "djur",
   "flaggor": []
  },
  {
   "ord": "snö",
   "lista": 3,
   "bild": "❄️",
   "tema": "natur",
   "flaggor": [
    "aao"
   ]
  },
  {
   "ord": "spade",
   "lista": 3,
   "bild": "🪏",
   "tema": "verktyg",
   "flaggor": []
  },
  {
   "ord": "spindel",
   "lista": 3,
   "bild": "🕷️",
   "tema": "djur",
   "flaggor": []
  },
  {
   "ord": "spår",
   "lista": 3,
   "bild": "🐾",
   "tema": "dino",
   "flaggor": [
    "aao"
   ]
  },
  {
   "ord": "stav",
   "lista": 3,
   "bild": "🪄",
   "tema": "magi",
   "flaggor": []